Name,Location,Type,Address,Description
Isle Royale,"Houghton, MI",National Park,800 East Lakeshore Drive / Houghton / MI / 49931,"Explore a rugged, isolated island, far from the sights and sounds of civilization. Surrounded by Lake Superior, Isle Royale offers unparalleled solitude and adventures for backpackers, hikers, boaters, kayakers, canoeists and scuba divers. Here, amid stunning scenic beauty, you'll find opportunities for reflection and discovery, and make memories that last a lifetime."
Keweenaw,"Calumet, MI",National Historical Park,25970 Red Jacket Road / Calumet / MI / 49913,"From 7,000 years ago to the 1900s people mined Keweenaw copper. Native peoples made copper into tools and trade items. Investors and immigrants arrived in the 1800s in a great mineral rush, developing thriving industries and cosmopolitan communities. Though the mines have since closed, their mark is still visible on the land and people."
Motor Cities,"Detroit, MI",National Heritage Area,"200 Renaissance Center, Suite 3148 / Detroit / MI / 48243","If you are interested in automotive history, then MotorCities National Heritage Area is the place to be. Tour the factory where Henry Ford created and built the Model T. Learn the stories behind the creation of General Motors and DamilerChrysler. Come with us and learn about the long and sometimes tenuous relationship between Labor and Industry while experiencing southeast Michigan."
North Country,"Seven States-New York to North Dakota , MI,MN,ND,NY,OH,PA,WI",National Scenic Trail,PO Box 288 / Lowell / MI / 49331,"Come to the North Country. Trek the hills and valleys. Lakes and streams remain from glaciers that molded the landscape 10,000 years before. Experience clear-flowing water, the red and gold of autumn, a fairyland of snow, tall grass prairies, and distant horizons. From New York to North Dakota, you're never far from a great outdoor adventure. Experience your America at a walking pace."
Pictured Rocks,"Munising, Grand Marais, MI",National Lakeshore,P.O. Box 40 / Munising / MI / 49862,"Sandstone cliffs, beaches, sand dunes, waterfalls, lakes, forest, and shoreline beckon you to visit Pictured Rocks National Lakeshore. Hiking, camping, sightseeing, and four season outdoor opportunities abound. The lakeshore hugs the Lake Superior shoreline for more than 40 miles. Lake Superior is the largest, deepest, coldest, and most pristine of all the Great Lakes."
River Raisin,MI,National Battlefield Park,1403 East Elm Street / Monroe / MI / 48162,"River Raisin National Battlefield Park preserves, commemorates, and interprets the January 1813 battles of the War of 1812 and their aftermath in Monroe and Wayne counties in SE Michigan. The Battle resulted in the greatest victory for Tecumseh’s American Indian confederation and the greatest defeat for the U.S. The resulting rally cry “Remember the Raisin” spurred support for the rest of the war."
Sleeping Bear Dunes,"Empire, MI",National Lakeshore,9922 Front Street / Empire / MI / 49630,"Miles of sand beach, bluffs that tower 450’ above Lake Michigan, lush forests, clear inland lakes, unique flora and fauna make up the natural world of Sleeping Bear Dunes. High dunes afford spectacular views across the lake. An island lighthouse, US Life-Saving Service stations, coastal villages, and picturesque farmsteads reflect the park’s rich maritime, agricultural, and recreational history."
